{"$schema":"https://json-schema.org/draft/2020-12/schema","$id":"https://alpitt.github.io/-knaus-companion/data/reasoning.schema.json","title":"Knaus Companion local reasoning configuration","type":"object","additionalProperties":false,"required":["schemaVersion","intents","entities","sourceTypes","safetyClasses","confidenceRules","rankingRules","responseTemplates","followUpRules","refusalRules","escalationRules","metadata"],"properties":{"schemaVersion":{"const":1},"intents":{"type":"array","items":{"$ref":"#/$defs/rule"}},"entities":{"type":"object"},"sourceTypes":{"type":"array","items":{"enum":["companion-chapter","manufacturer-manual","engineering-canon","digital-twin","electrical-diagnostic","water-diagnostic","gas-diagnostic","heating-diagnostic","refrigeration-diagnostic","maintenance-task","fault-record","measurement","owner-record","photograph","document"]}},"safetyClasses":{"type":"array","items":{"enum":["informational","caution","electrical-risk","gas-risk","fire-risk","water-damage-risk","vehicle-safety-risk","professional-inspection-required","emergency"]}},"confidenceRules":{"type":"object"},"rankingRules":{"type":"object"},"responseTemplates":{"type":"object"},"followUpRules":{"type":"array","items":{"$ref":"#/$defs/rule"}},"refusalRules":{"type":"array","items":{"$ref":"#/$defs/rule"}},"escalationRules":{"type":"array","items":{"$ref":"#/$defs/rule"}},"metadata":{"type":"object"}},"$defs":{"rule":{"type":"object","required":["id","phrases"],"properties":{"id":{"type":"string","minLength":1},"phrases":{"type":"array","items":{"type":"string","minLength":1}},"weight":{"type":"number"},"message":{"type":"string"}},"additionalProperties":true}}}
