{
  "schemaVersion":1,
  "intents":[
    {"id":"identify-component","phrases":["what is","identify","component"],"weight":3},{"id":"locate-fuse","phrases":["fuse","which fuse","fuse for"],"weight":5},{"id":"diagnose-symptom","phrases":["not working","fault","problem","smell","noise","warning"],"weight":4},{"id":"explain-system","phrases":["how does","explain","system"],"weight":3},{"id":"maintenance-due","phrases":["maintenance due","service due","overdue"],"weight":5},{"id":"maintenance-procedure","phrases":["maintenance procedure","service procedure","how to maintain"],"weight":4},{"id":"interpret-measurement","phrases":["volts","voltage","amps","current","temperature","reading","measurement"],"weight":5},{"id":"find-document","phrases":["document","certificate","invoice"],"weight":3},{"id":"find-manual-page","phrases":["manual page","page"],"weight":5},{"id":"find-chapter","phrases":["chapter"],"weight":5},{"id":"find-canon-entry","phrases":["kb-","kb2-","canon"],"weight":6},{"id":"find-digital-twin-entity","phrases":["digital twin","twin","component:"],"weight":5},{"id":"explain-evidence","phrases":["evidence","confirmed","confidence","source"],"weight":4},{"id":"compare-options","phrases":["compare","versus"," vs "],"weight":3},{"id":"safety-check","phrases":["safe","danger","risk","emergency"],"weight":5}
  ],
  "entities":{"systems":["electrical","water","gas","heating","refrigeration","vehicle","habitation","safety","communications","accessories"],"units":["v","volts","a","amps","c","°c","bar","psi"]},
  "sourceTypes":["companion-chapter","manufacturer-manual","engineering-canon","digital-twin","electrical-diagnostic","water-diagnostic","gas-diagnostic","heating-diagnostic","refrigeration-diagnostic","maintenance-task","fault-record","measurement","owner-record","photograph","document"],
  "safetyClasses":["informational","caution","electrical-risk","gas-risk","fire-risk","water-damage-risk","vehicle-safety-risk","professional-inspection-required","emergency"],
  "confidenceRules":{"values":["confirmed","high","medium","low","insufficient-evidence"],"source":{"digital-twin":"high","manufacturer-manual":"medium","companion-chapter":"medium","engineering-canon":"medium","maintenance-task":"medium","electrical-diagnostic":"medium","water-diagnostic":"medium","gas-diagnostic":"medium","heating-diagnostic":"medium","refrigeration-diagnostic":"medium"}},
  "rankingRules":{"exactIdentifier":50,"exactTitle":30,"digitalTwin":12,"ownerSpecific":10,"manufacturer":8,"confirmed":10,"system":7,"component":8,"intent":6,"phrase":5,"keyword":2,"safety":4},
  "responseTemplates":{"answer":"The strongest local evidence is: {summary}","insufficient":"I do not have enough documented evidence on this device to answer that safely.","nextCheck":"Open the highest-ranked source and confirm the vehicle-specific details before acting."},
  "followUpRules":[{"id":"insufficient","phrases":["insufficient-evidence"],"message":"Can you provide the component name, system, symptom or measured value?"}],
  "refusalRules":[{"id":"unsafe-bypass","phrases":["bypass fuse","bridge fuse","defeat interlock","work live"],"message":"I cannot provide instructions to bypass protective equipment or work on live electrical systems."}],
  "escalationRules":[{"id":"emergency","phrases":["gas smell","carbon monoxide","fire","smoke","battery fire","brake failure","steering failure"],"message":"Stop using the affected system, move to safety when appropriate, and obtain professional or emergency assistance."}],
  "metadata":{"localOnly":true,"externalCalls":false,"generatedAnswers":"deterministic","historyLimit":20}
}
